post,id
"В корпусе, расположенном по адресу на Декабристов, работают крайне невнимательные и некомпетентные гардеробщики. Мне плевать на их национальность и возраст, но когда человек сдаёт номерок и ему дают чужую куртку или же подходят обратно к Вам и говорят, что Вашей куртки не висит на крючке - это сверхразума. Если работаете в гардеробе, так будьте так любезны выполнять своë дело качественно. Это наблюдается не первый раз и сильно приносит неудобства.  Анонимно, пожалуйста.",280
"Не понимаю почему было так много негатива насчет университета, по-моему люди тут все адекватные, преподаватели своеобразные, но справедливые, а самое главное это то что дают знания. Единственный минус это разброс корпусов, деньги на проезд тратить приходится, но я так понимаю, это все вузы города в такой же ситуации.
Всем бобра✌🏻
Анонимно",760
"Кто нибудь сдавал немецкий у Марины Геннадьевны?
9 человек из группы не можем успеть выучить и понять материал что дает 
Также не зачете колоссальные требования 
Анонимно",672
"Здравствуйте) применяют ли ваши преподаватели какие нибудь инструменты для того, чтобы студенты на опаздывали на их предмет? или спокойно пускают? 
я помню, у нас был препод, который заставлял петь припев какой нибудь песни, если ты опоздаешь
анон",517
"Учусь в УГАТУ на ИНЭК , если решаете куда подать документы то вам точно сюда!! Понимающие , добрые преподаватели и хорошее отношение к студентам.",1140
"Анонимно
Это норм, что до сих пор нет расписания сессии? Есть у вуза какие-то внутренние документы по этой теме? Осталось меньше недели, все молчат. Издевательство.",184
"Вай фай в черёмушках отключили, чтобы студенты не писали «Где новая общага?»",312
"Читаю пост  про то, как в УГМУ все плохо, в комментах пишут, что автор нытик и что надо привыкать к такому отношению как к быдлу со стороны универа т.к. это норма в здравоохранении Автор, я на твоей стороне, ты все правильно пишешь, и мириться, когда некоторые преподы (не все конечно) и чинуши из деканата выливают на нас ведро помоев, нельзя Те, кого это устраивает и кто уже морально готовится к этому на работе в больнице - это их выбор. Не все должны быть такими.
анон",1190
"А я бы хотела выразить слова благодарности ассистенту кафедры нормальной физиологии Капралову А.И. Да — сложно, да — приходится идти на пересдачу, но те знания, которые он дает неоднократно помогают на третьем курсе. Быть теоретиком одно, а осуществлять подачу материала через призму практики — совсем другое. Всегда поймёт и пойдет навстречу. Алексей Игоревич, спасибо вам за все!!!

Анон",51
"Лучшая преподавательница по английскому-это Волгина И.В Просто любовь
анон",692
"Товарищи студенты! И все кто стали свидетелями моего первого сообщения. Прошу прощения за срыв. 
Я думаю каждый знаком с 2-мя ситуациями в жизни. 1-Винить другого человека в своих проблемах и проколах. 2-Необоснованная агрессия и оскорбления к тебе. Хотя ты был доброжелателен и в общем ничего плохого не сделал. Так как все мы люди и все мы эмоциональны любого можно понять. 

Людмила Ивановна один из тех преподавателей которых слушаешь открыв рот и очень долго. Таких преподавателей мало, особенно заинтересовавших учеников. Благодаря этому замечательному преподавателю у меня в голове хоть что-то сохранилось из 3-х курсов из которых я ходил и слушал только на первый.
 Всем удачи в обучении! И ещё раз прошу прощения.

Не анон и выложить прям срочняк пж!",1101
"Кому жаловаться на охранника? 
Как можно позволять себе какие-либо фразы в сторону девушек, даже если ты не в трезвом виде (на рабочем месте, между прочим) ну постарайся себя контролировать. Такое ощущение, что этому молодому охраннику его короной, которую он себе напредставлял, мозги пережало. Противно.
Анон",643
"Кстати, да, в тему об охраннике. Совершенно безманерное, угрюмое, конфликтное существо, которое возомнило о себе слишком многое и решившее, что может отпускать комментарии в сторону людей, находиться на работе пьяным и долбиться по ночам в двери к девушкам. Смотрит пропуски под микроскопом, делая вид, что охраняет засекреченный объект и лениться нажать кнопку, чтобы выпустить людей. Наберут молодых и высокомерных людей, а они своим отношением портят жизнь студентам и не дают спокойно входить и выходить из общаги.

Анон.",657
"Не согласна с тем, что недовольны только лентяи и прогульщики. Я пришла в академию с горящими глазами и огромным желанием учиться по специальности. Первые два года были замечательными. С третьего пошла херня - один предмет некому вести, потом другой. Почему не перешла? Думала, что это всё пандемия, и все утрясется. Когда не утряслось - оставался один год, и переходить было бессмысленно.",766
"Господа, случилась такая ситуация, на работе дали фейковую справку о болезни, пропустил по ней экзамен, ее проверили, действительно фейк, теперь УО говорит, пиши объяснительную, тебе грозит отчисление. При чем я вообще хз каким образом мой работодатель сделал эту справку, я к нему обратился, так как «медицинское страхование же присутствует», кто нибудь сталкивался с подобной ситуацией, что вы писали в объяснительной? Лайкните, или оставьте коммент, пж.
Анон",399
"Когда появится расписание на сайте? Почему там нет никаких групп? В августе появится или в сентябре???",629
"Почему я прочитала подслушано после зачисления и заселения?😭 Половину дня стояли всей семьей на улице, Заселили в клоповник, будто до нас тут бомжи жили… уже и желания нет тут находится",938
"Не понимаю, почему столько негатива выливается на единый деканат... Люди стараются сделать приятным присутствие в своём кабинете. Проделывается большая работа, чтобы студентам было комфорто. Постоянно происходят изменения в лучшую сторону. Теперь не надо стоять в коридоре большой толпой, а можно спокойно посидеть в кабинете и ждать свою очередь. Повесили плакаты, чтобы украсить помещение. Лучше смотреть на пустые стены? Если кого-то не устраивает работа сотрудников, Вы можете обратиться к ним л",763
"А почему обучение так резко подорожало?! Тысяч на 5 точно",38
"анонимно!!!!
потому что не дай бог за своё личное мнение дойти до деканата)))
в общем, чтобы вы понимали суть темы: учусь на 1 курсе ТЕХНИЧЕСКОГО института. логично, что основные предметы - это физика, математика и химия, а не основы российской государственности и история россии. про то, что я учусь на 1 курсе и есть такие предметы, я понимаю. но преподовательницу по истории абсолютно не понимаю. она задает бешеное количество дз на екурсах (эссе,презентации и т.д.); работа всегда должна быть обьемной и своими словами (проверяет через антиплагиат). то есть, чтобы вы понимали, нужно париться над её предметом. конечно, после всех этих сделанных заданий можно выдохнуть смело в конце семестра…. но…. то, как будет проходить зачет - это действительно ужас. нужно будет к зачету выучить 30 вопросов. каждый вопрос оооочень обьемный. я не понимаю, зачем? я иду на историка или что? ПЛЮС ЭТО ЗАЧЕТ, а не экзамен. 
чтобы вы больше понимали её: для автомата нужно 200+ баллов… и это баллы чисто вытекают из докладов на парах. то есть ты рассказываешь доклад и получаешь за это баллы. окей норм. но 200+ баллов за 3 месяца….
я честнг не понимаю её. зачем так топить. кому на технической специальности захочется мало того, чтобы выполнять её задания на екурсах, так и еще 30 вопросов учить. 
я бы хотел, чтобы вы понимали действительно суть этой катастрофы. хотел бы, чтобы она сама СВОИМИ ГЛАЗАМИ прочитала эту запись, и одумалась насчет своей системы.
я буду рад услышать Ваш ответ, Григорьева Екатерина Александровна 😘",1300
"Хочу признаться в безграничной любви ко всем факультетам наше вуза ❤️ Вы все самые лучшие!!!",1176
"Анон
Как вы относитесь к преподавателям-нарциссам? 
У нас в колледже ОмГТУ есть препод, именующий себя не иначе как МАЭСТРО инженерной и компьютерной графики💀 При этом он сам по себе в своем предмете разбирается как-то не очень (будто сам только что прочитал то, о чем нам рассказывает)",98
"Анон

Я регулярно прихожу на лабы, и каждый раз спрашиваю, можно ли сдать лабу. Каждый раз мне отвечают, нет. Я спрашивал уже раз 150 и 150 раз мне ответили нет. Смысл в том, что отвечает мне один и тот же преподаватель, отвечает с неизменной интонацией. А я каждый раз с неизменной интонацией спрашиваю:

— Лабу сдать можно?
— Пошёл вон!

— Я иправил, вы можете посмотреть?
— Я тебе сказал: сегодня у тебя ничего не приму.

— Посмотрите работу пожалуйста.
— Я не собираюсь тратить на тебя время.

— Я учёл ошибки и исправил, можете посмотреть лабу? 
— Ты мне не интересн.

И ведь этот преподаватель, знает меня идеально в лицо, знает, что я спрошу и знает, что он мне ответит. Но ещё ни разу ни один из нас ни жестом, ни словом не показал, что каждый из нас знает сценарий. Бывает, преподаватель уходит из аудитории, тогда я доделываю лабу и ожидаю его. Возвращаясь, он стремительно идёт к столу:
— Что ты хочешь?
— Я работу хочу сдать.
— Я не собираюсь тебя учить.
— А что с работой длеать.
— Я не знаю.
Иногда он общается с другим студентом, тогда, стоя рядом, я терпеливо жду, когда они закончат:

— Посмотрите, я исправил.
— Я у тебя принимать ничего не буду.

Иногда он просто скучает за столом, когда все сутденты заняты работами, и только я стою подле него. Конечно, он знает, что будет дальше, но не подаёт виду и равнодушно берёт лабу:

— Можно лабу сдать?
— В обработку данных посмотри, там много страничек, почитай, тебе понравится.

Это очень суровое, по–настоящему мужское противостояние, исход которого неясен. Очевидно, что каждая сторона рассчитывает на победу. Впрочем, я уже согласен на ничью.",80
"Бауманка – это лучший технический!

А ещё Бауманка – это возможности, среди которых каждый обязательно находит что-то своё. Пиши в комментариях, что МГТУ значит для тебя🥰",254
"Ваше мнение про Тонкова.Д.Н?(физика)
Надоел уже, душит люто, че бы не делал/а, обиженный на жизнь, да и в целом будто не в себе вечно, помешанный на предмете своём, короче странный, надеюсь первый и последний семак ведет у моей группы",315
"А я скучаю по Мальцеву. Единый деканат однажды эксплуатировали практикантов, заставляли делать их работу, так Мальцев спустился и дал всем по бошке. Красава!",53
"Я сюда поступил не из-за низких баллов! 
Здесь училась моя тётя, говорила, что у меня будут прекрасные студенческие годы в этой Академии. Но, сейчас я понял, что это вторая шарага после Синергии.",1268
"Сюда бесполезно писать и просить, нужно напрямую идти к ректору. Писать все горазды. Учимся за деньги , а отношение такое ,будто Коротков из своего кармана за нас платит",1092
"Ин Ша Аллаh, всем из-за кого уволилась Рамиля Галимовна, всё вернётся. Аллаh всё видит, и не оставит это так. 🤲
Рамиля Галимовна, ждём Вашего грандиозного возвращения, когда будет новый состав руководства. Скоро

Вот интересно, Орлова ещё долго будет сувать свой нос в юриспруденцию?! 
Анонимно",548
"А почему нас надо сравнивать именно с МГУ? Почему не с РУДН, где за оскорбления нации отчисление  в тот же день. Ах да, у нас же руководство любит только русских)",37
"Прежде чем вставлять свои 5 копеек и опираться на УК РФ,нужно знать ситуация полностью. Может, Вам обидно, что за бывшего декана юридического факультета так заступаются, а Вас никто и не знает? И что вы вообще делаете.
Своим поведением Вы показываете свою никчёмность.
Ваш удел - это сидеть в студенческой группе и спорить со студентами, но никак ничего не делать. 
Вы можете что угодно писать, но все мы знаем, на чьей стороне правда. Вы начните хоть как-то работать, чтоб не было таких претензий. Мы свои права и обязанности очень хорошо знаем. А вы свои обязанности и свою работу знаете?
Я думаю, многие тут со мной согласятся, что Новикова - единственный декан, который проявлял уважение к студентам, умела работать с нами и находить общий язык.
Сравнили МГУ и АТиСО. Нам бы элементарно в академии ремонт сделать, чтоб сравнивать друг друга. И какая тут форма общения? Люди пишут правду и кто кем является. И всё.
Мы имеем полное право на мнение и его выражение. По-крайне мере тут! 
Когда душонка чиста, то одно место не горит.)

Анон",949
"Анонимно, пожалуйста. 

Последние несколько дней живу с вопросом: ""А судьи кто?“. Так смешно и в то же время очень грустно читать посты в подслушке. Как так можно относиться к взрослым людям? Ни капли уважения, даже к женщинам. 
Если кого-то что-то не устраивает в академии, здесь, вроде как никого насильно не держат. Это вы ухватились за низкие цены и держитесь. 

У вас есть притензии к работе руководства АТиСО, но, когда оно выполняет свои обязанности, например, проверяет посещаемость (почитайте правила внутреннего учебного распорядка), вас опять что-то не устраивает.
Вы пытаетесь ""добиться"" к себе хорошего отношения довольно странным способ, не находите?
Я вас уверяю, обратиться в письменном виде к ректору или любому сотруднику напрямую было бы более эффективно.

На самом деле, очень странная позиция у возмущающихся. Не устраивают проверки Игоря Владимировича? Так ходите на пары. Работа не является уважительной причиной для отсутствия у студента очника. Была предоставлена возможность написать объяснительную и приложить доказательства того, что кого-то не было по уважительной причине. Кто хотел - тот сделал.
Откуда вам известно, почему Рамиля Галимовна больше не работает в академии? И с чего вообще кто-то взял, что Коротков как-то причастен к её увольнению?
Позволю себе дать совет: не надо устраивать здесь какое-то революционное движение. Вы не решите свои проблемы таким путем. Тем более в этом сообществе. 

В дополнение хочу сказать, что тот, кто действительно хочет учиться, тот будет. Преподаватели Академии работают и в МГУ, и в МГИМО, и в ВШЭ, и т.д., так что везде все, по большей степени, одинаково. Просто кто-то не доходит до аудитории, оставшись в коридоре, кто-то в окошко смотрит, а кто-то и вовсе планирует появиться только на сессию. 

Стоит ли требовать к себе уважения, если так себя вести. Очень удобно спихнуть все на кого-то. В высшем учебном заведении учатся взрослые люди, а не дети, которым надо все принести на блюдечке с голубой каемочкой. Повторюсь, если кого-то что-то не устраивает, двери на выход всегда открыты. Вопрос в том, ждут ли вас в других дверях, и угодят ли вам там. Плохому танцору, всегда что-то мешает.",211
"Прежде чем проводить обходы посещаемости, перестаньте прямо на парах преподавателей дергать с вопросами и совещанками. Студентам не интересно, когда у вас ректораты и т.д., если из-за этого нам приходится на паре сидеть и ждать преподавателя. Оставьте их в покое и дайте нас нормально обучать",950
