post,id
"Закончился дистант. Очень люблю очные  пары. Но также сильно ненавижу лекции. Просто бессмысленная трата времени. Уже все кафедры записали замечательные вебинары к парам. Отлично было, зашёл, прочитал, подготовился. 
Теперь каждую лекцию начинают со слов, ну если вы не успеете, то найдёте лекцию в эосе и прочитаете
Вопрос возникает, а зачем тогда мы тратим драгоценное время и преподавателей, и студентов!",494
"Кто-то знает, почему закрыли едва открывшиеся новые туалеты на 5-6 этажах 1 корпуса и когда планируют открыть? 
Анон",679
"Анонимно
Зарегистрировалась через сайт вуза, хотела подать документы через них, но постоянно возникали проблемы( не удалось)
Подавала документы через гос услуги
В итоге я есть в списках, но не уверена что это так, потому что на гу статус ""на рассмотрении"" 
Слышала, что это нормально
Хотя по-моему так не должно быть
У кого так же поделитесь пожалуйста",171
"анонимно. 
всем привет, подал документы на платное обучение и не знаю чего дальше ждать: не звонят , не пишут и ничего собственно непонятно. Я боюсь , что на платном обучении есть конкурс и не знаю , когда ехать подписывать контракт с вузом, что делать ?",1303
"Ребят, дайте супер-средство , посылающие тараканов в космос или в мир иной , задолбали в общаге, сильные средства не помогли .",1014
"Вот вот числанут.
Допса, масса предметов...
Пока бегу на перегонки со временем, но шансов совсем немного...
Самое обидное, что в последние дни ощутил и интерес к учебе, и познакомился с новыми преподами, которые превзошли все ожидания...
Уже двадцать раз визуализировал, как отчислят, как уеду в свой родной город... Как-кто то из родных может вообще это не пережить. Как буду избегать всех, кого в том городе знал.
Как буду ненавидеть себя, и каждую ночь возвращаться во сне в Петербург.
Все эти бесконечные разговоры об одном и том же, упрёки, слёзы, скандалы, последние слова в мой адрес... Всё это ждёт меня дома.
...
Тщетно пытаюсь вернуть желание жить, или хотя бы желание бороться непонятно за что, непонятно зачем...
...
Хочется забиться в угол, и поскорее умереть.
Не хочется просыпаться, не хочется просто существовать...
...
Когда летишь с моста - понимаешь, что все проблемы реашемы...
Но разве это тот случай?
...
Анон",333
"Неужели во всем МГСУ нет нормального места где можно посидеть? Не вот эти железные сиденья в бродвее, а что то более приличное",775
"Почему у преподавателей такое негативное отношение к коммерческим студентам? Особенно у преподов взрослых. Мне кажется, уже все понимают, что бюджет - это не всегда быть супер умным и сдать экзамены на 300б 
. Это в том числе и целевые с баллом 180, и многие другие факторы, которые не дают объективной оценки знаний

Анон",928
"Хочу передать спасибо кафедре топографической анатомии от студента педиатрического факультета.
Старшие курсы и леч.фак пугали какие вы злые и страшные, можете только завалить и все.
Сегодня я убедился, что все наоборот. На экзамене была такая идиллия, преподаватели самые добрые и самые лучшие. Не было не какого напряжения совсем. Я был даже немного удивлен. Также мои сокурсники говорят, что за всю историю сессий это самый лучший экзамен.
Еще раз большое вам спасибо 🙏🏻 .
Вы лучшие.
Прошу анонимности",1167
"Здравствуйте. Хочу оставить тут комментарий по поводу гардероба конкретно в 9 корпусе. Новые люди, которых туда набрали, абсолютно злые и обиженные на жизнь, такой критерий отбора? Почему они себя так агрессивно ведут? Приходишь на пары в хорошем настроении а выходишь от них злой. 
Хотел сдать куртку, двухстороннюю, соответсвенно она без вешалки. Весь прошлый год разрешали сдавать и клали на подоконник, безо всяких проблем . Новенькие сказали, что это категорически запрещено :( 
Преподаватель не пускает в аудиторию с курткой. Ну и как быть? Может, мне купят новую куртку, с вешалкой, чтобы можно было сдавать?",534
"Когда уже отменят очные лекции как пережиток СССР? 
Зум зачем изобрели? Колесо круглое внедрили, сами препод на нём же и катаются. А давайте будем по-старинке, студентам так было бы удобнее! Если бы вы не приехали на консу на своём квадратно-колёснике. Все бы выиграли. Или это просто отработка денег? Ехать за город всем скопом  заразу собирать.

Очные консультации по экзаменам: Экзамен очень важный, студенты плохо помнят материал первого семестра, так как был он давно. Пффф. РАЗДРАЖАЕШЬ. СМОЙСЯ.",635
"Почему в мужском туалете на кафедре анатомии нет мыла? Раньше из дозатора можно было какие-то капли выдавить, сейчас он вообще пустой... Как студентам мыть руки после  препаратов? Это точно медицинский вуз?
Анон",871
"Я из 1 курса, расписание жесть вообще. Думаю надо чтото делать",1247
"Анонимно, пожалуйста.
Позвольте выругаться небольшому студенту колледжа МПГУ о ситуации в корпусе. Какое именно здание станет понятно тем, кто в нем учится, если прочитает пост ниже.
1. Господа, а вас не стало подбешивать, что в здании, где сидит 400 с лишним голодных ртов, благополучно закрыли столовую? Нет, перестали вы там готовить, бог с вами, но оставьте её открытой хотя бы для того, чтобы народ не ел в кабинетах. Из этой проблемы вылезает вторая:
2. Уважаемая администрация, если вы не будете выпускать толпу на улицу, чтобы банально она могла зайти в магазин, то толпу не остановит один несчастный турникет, который вы установили на выходе, и даже не сделали электронные пропуска! Извините, но это цирк. Не выпускают ни-ко-го. 
Несовершеннолетние- нельзя.
Совершеннолетние- также нельзя. Извините, а какого черта!?
Поверьте, я люблю место, где учусь. Здесь замечательные педагоги и студенты, но правда, лучше бы вместо пуфиков, которые перепачкались в первые полгода, вы оформили студентам электронные пропуска;)
Всего вам доброго 💕",210
"Это норм, что на ломо в корпусе английского в туалете из под крана течёт кипяток, оставляющий ожоги на руках?
Анон",1231
"Анонимно!
Какое право имеет кафедра химии нам угрожать, если мы пользуемся чьими-либо образовательными услугами? Почему мы пытаемся понять предмет как можем,  а в ответ получаем угрозы на лекциях от ""большого специалиста"" в области натрий-калиевой атфазы😂
Нам на протяжении всего семестра угрожают проблемами на экзамене: подскажите пожалуйста, как быть в такой ситуации? Что может посоветовать администрация университета?",203
"Анон
Яковлева Татьяна Юрьевна богиня!!!!
лучший преподаватель по физике!",115
"Асланян Сергей Саятович лучший преподаватель по анату💯
анон)",252
"А на допсе можно выбрать другого препода? Просто ситуация, что нынешний слишком предвзято относится и точно не даст закрыться. Хотя на допсу попадаю только по его предмету 
Анон",35
"Шалоня Татьяна Александровна - лучший препод на патане, да и везде в принципе 🙏🏻❤️",1219
"Андреева Светлана Александровна самая лучшая из лучших преподавателей в этом универе!!! 
❤️😍🥰💐
анон",67
"Что делать, если преподаватель все время валит на пересдачах? Было даже такое, что отказывался выполненную экзаменационную работу смотреть",1200
"Анон

Когда на геофаке откроют столовую?? 😭",69
"Преподаватель Гусев самый лучший❤️❤️❤️❤️❤️
Анонимно",954
"Лучший преподаватель Погодин🥰🩷",693
"Анонимно 
То есть всех устраивает заварка в столовке кгф по 45₽ за пакетик?😕",194
"Не совсем понимаю. 
Почему Орлов по анатомии заставляет повторно сдавать зачет. Если по расписанию в определенный день мы сдали зачет письменно, то через неделю он снова заново начинает принимать зачет, даже если в этот день уже новая тема. 
+ аннулирует весь твой ТРУД! 
Ничего слышать не хочет, только себя слышит. 
Мы даже боимся отвечать ему, так как он даже слушать не будет, начинаешь рассказывать - сразу перебивает, это касаемо хорошистов и отличников. Считает, что все оценки, которые ставили до него, это ничто, то есть обесценивает оценивание преподавателей - Иониной и Чирятьевой. Хотя они тоже строго принимают, но в итоге с ними были «4» и «5», с Орловом все скатилось. Опять же нет желания ему отвечать, потому что в любом случае унизит и выставит мусором.",765
"Какие же конченные те , кто отвечает за стипендию . Мало того что постоянно выплачивают по частям эти выплаты, так на этот раз вообще ничего не дали как положено , на что жить , как платить за квартиру .  Да коле ?",603
"Во втором семестре Тюмина продолжает жестить или уже требует меньше на парах? Начинаются сложные профильные предметы по типу биохимии и гистологии, времени будет ещё меньше , а мне и без них в том семе чудом удалось английский закрыть.... Подскажите, пожалуйста.
Анон.",321
"Крик души. Недавно общался с челиком из одного мед. колледжа (Братск). Пока общались, он слушал какую-то онлайн-лекцию (не по медицинской дисциплине, собственно поэтому мы и общались, не особо обращая внимание на лекцию). Я его спрашиваю, почему у них так, карантинов же нет. Он меня не понял и говорит ""так удобно же так, и преподам норм"". Их там тоже отмечают (но не прийти на онлайн-лекцию это кем вообще быть надо). КОЛЛЕДЖ ЭВОЛЮЦИОНИРОВАЛ ДО ЭТОЙ ИДЕИ, А НАС ДО СИХ ПОР ПО ГОЛОВАМ КАК СКОТ СЧИТАЮТ. Практические занятия у них очные, если вдруг кто найдется сказать, что ""людей вы тоже по компухтеру лечить будете??!"" НУ Я НЕ МОГУ. КАКИМ ОБРАЗОМ ЗНАНИЯ УСВАИВАЮТСЯ ЛУЧШЕ В ЛЕКЦИОННОЙ АУДИТОРИИ? Не знаю, как в Братске так получилось, может после карантина решили, что такое дело в целом удобно, качество же не страдает. Что там лекцию со слайдов читают, что тут. Да и для эпид. обстановки это только располагает.",653
"Хотела бы обратиться к студентам, которые оставляют свою обувь в ГЛАВНОМ корпусе университета. Это ведь ГЛАВНЫЙ корпус, в котором находится клиника, туда ходят пациенты. Обувь стоит вокруг пуфиков, ни сесть, ни переодеться. Про эстетический вид я вообще молчу. И стоит это все вплоть до гардероба для пациентов. Думаю, что это уже слишком. 
Давайте, пожалуйста, не доводить университет до бардака! Ну сложно что ли взять пакет с собой? Магазины кругом, сходите, купите. В некоторых корпусах уже и пакеты для вас предоставляют, в гардеробах принимают, все для вас сделали.",1149
"Администрация вуза😡3 года назад вы приняли правильное решение - и в 1 корпусе полностью решили проблему обуви. Повесили объявления везде, что обувь оставленная выбрасывается. И через пару дней забива студентов вся обувь действительно была выброшена. И проблема сама собой решилась буквально за день-два

Но после ремонта все сообщения сняли, а теперь обувь не выбрасывается, складируется как и раньше в тёмные времена. Пора снова выкидывать. Когда увидят свои тапки на улице - мигом исправятся. И в главном тоже бы

Лайк, если согласны❤️",61
"А чем занимается у нас профсоюз? Кто то видел от них позитив? Даже не могут для нас договорится полочки для обуви сделать? А?",43
"Всех так раздражает обувь, но поверьте студенты миллион раз просили сделать нормальный гардероб, где можно было бы класть или хотя бы сдавать обувь. Вот представьте, вы студент, у вас хиругичка, учебники, тетради и все это в руках и еще пакет обуви, который таскается по всему учебному заведению, а это, на минуточку, грязь и к тому же все капает. Вы скорее всего скажите, дак заверните в два пакета и ходите. Мы ходим в халатах и шапочках на некоторых кафедрах, чтобы было более менее стерильно и аккуратно, тогда зачем это все, если в руках грязная обувь, которая еще лежит всю пару в кабинете. Когда врач приходит на работу, он не берет с собой обувь в кабинет, а кладет в специальное место. Почему у нас нет тогда такого же места?",381
"Про обувь в главном корпусе.
Вы вините студентов в том, что они не могут убрать свою обувь в пакет и сдать в гардероб, но вы же не знаете наверное, что когда обувь полежит в пакете с неё вся грязь стекает в этот же пакет и все кроссовки сразу становятся мокрыми и грязными, следовательно быстро теряют вид, а с нашими стипендиями денег на новую обувь не напасёшься. Поэтому организуйте хотя бы полочки или место для обуви, куда можно будет поставить обувь, не переживая за то, что она испортится.",990
"Я родилась в очень бедной семье четвертым ребенком. Сразу поняла, что нужно любыми силами поступать в город. Ближайшим был Тюмень. С первого раза не прошла на бюджет в медицинский, год работала, копила деньги, готовилась к пересдаче ЕГЭ и знакомилась с людьми в интернете. Самый лучший вариант работы был оператором в такси, но он несовместим с жизнью в общежитии. Сняла комнату пополам со знакомой, работала ночами на общей кухне спала. Оканчиваю третий курс медицинского и понимаю, что я выжила! Выбралась! Стало гораздо легче. Зарплату подняли, пары больше не ставят на 8 утра. Анатомию и гисту сдала. Учиться с каждым годом легче! Я смогла!
Всем успехов.",1267
"А я люблю Лошарка и это правда
Лайк кто тоже его как препода любит и уважает",52
"Анон
Никогда не нравилась анатомия, и сейчас началась топка. Просто воротит от этого предмета, не хочется ничего учить, еще и преподаватель такой, который ничего не требует, соответственно, изучение предмета лежит полностью на моей ответственности и от этого еще хуже. Что можно делать в таком случае, может есть какие то советы?:(",102
"Почему такая вонь в переходе 2-4 корпус кто там умер",923
"Крик души просто. Все мы знаем, что наш уважаемый Гайдар Мамедович всех выпускников добровольно-принудительно обязует вступить в свою ассоциацию под предлогом мол не пройдёте аккредитацию. Логично, что после этого никто потом взносы платить не будет. Но вот он или его летучие обезьяны решили зайти с другого конца, опозорить неплательщиков через главных врачей МО. На планёрках теперь зачитывают имена тех, кто не платит взносы. Очень приятно слышать свою фамилию…
Ну и собственно после такого вопрос оплаты взносов точно отпал.
Еще бы на шторы собирали, позорники!

Адм: если под комментариями отпишутся больше 15 человек с пожеланием удалить пост, то удалю",650
"если преподавательница вызывает плохие мысли, нормально ли студенту (после отчисления) впасть в депрессию? а если это первый курс?
Анонимно",1326
"Куда можно обратиться, если преподаватель на всех своих парах рассказывает вещи, очень косвенно связанные с предметом, и в основном гнёт свою линию, проводя откровенную агитацию, которую приходится выслушивать из раза в раз и вообще не понимать, о чем был предмет, им преподаваемый?",682
"Блин хороший вуз, не понимаю почему многие жалуются",258
"Где степуха? Почему задерживают? Впереди выходные, что, после них придет? Анон",393
"Ребята,у кого Храбров ведёт инфу,как ему работы сдавать и когда? Этот перец меня на пересдачу отправляет всегда,а потом не принимает работы😡😡😡😡",1033
"Ммм, как же вкусно поел в столовке на Ломо 😋",707
